{
  "schema_version": "1.0",
  "type": "pred",
  "id": "d-2",
  "mu": "AkyfTvhENEiuTWNAh0nZS31LFlB1RStOy0wAUA9EVVCyPtFNS0rhSCJLiUkMPeVJGUgmTBxQIkXnTO1Cck6fNhA6FkY9TexHdU3HTn9EjE3aTSpL/1BxRYJNSjn7OvlQq0QeRc9M6E1hS39NoEY0TD5Pr0kUUmtKOkw0TBFKmj3ATu5HjUPLNhhKTEcYQtlEH0BTTHtMfk4BTmpO1kw2R9tMrk02SEZNXE4kSvxNc0ZUMHRIVDyyTitJTE6YUBhEDEdNRaRIyUg3SzNJaUKbRwVAwVDLSOFPVVD1RrVMiUymNSdKVkr4TLM7WE2ARjVIsFATTidFIUZMTSFN5DRXSFFJWjw5S+5FWEydSOFIkVA7Si5BGUuYTMFG70tPSr5PtDJQT95Qd01LTeFOLzmJUDRIF0n0T+xLE0WJRZRHkkxiRGJNPUqjTMBNwkARS01KM1DgUJVM30yLTLZO+VF9ScJHfErcQJxEqzyiUGZRQEmiTLtS5ky8Sdo51UglTdJHXUwQSQBFsVDNNK9OOk1AT2dJQ1HPSfMM8k0TTatK9Ev+SoFDbFBNUEdMpEaxTaFBnD9NTB8vkD7vUrdDW06aTnZD2U1xUZg/SUz/UcxNSE0kRX5NeUdtST9LikibRadKTzygTvtGZEoHQnZOHEuDSiFAhUwLUG1AykYDR5dGrkU=",
  "sd": "NkAbQxtFajQOQGlBOz39QaQ4aTy4NUxAxj4TOqQ8FkErQTJDrSqJQT8/iD40MYE4ZULsQq455j7VQFA66jisNio/5jRYQDU8MzdyPcg8mCzmPgFE0jlxM046/kLANKA9UzLbQVY+FUCuN+cnAUIYQkQ6Aj2DO6w4vj8hMpk8y0H8QPQ9ikPoOn82WTxPQOovkDo/MkM/XTwlQN44RjoSQfxBoDq7QEQ99UCHOKQ4rj5dPxw2VD0lQG1AskE1Pw1Coz/1NCY5DDvuOxc5EzhCQ29E8EIOPAVBHUVcPv495kTfPjJB8EARPLk0fECbNmU9jzp9OSNAnT71QGxCR0N6Op48XjrIOMQ1Wz90PI87Jz/mQg00bkA8ORRB6jT3Nmk0qz2TPLQ0fTPdP7dE2j/lOORERz0hPkk9qDa3QTZCDiS8OlBE5DQ8PSk/pTVpPsc6NS5mQRpG3TkpNLQ94S2vPYE7mTGnPf439D9fNW9CJkByLFhDG0AVQdRD1DRlGy1AKEJsPK45I0ANOlxAazCrMoZBJjz8POQ+fEFaPlxBnEGRQVhCX0IWQAxAU0IlOx06gTZxQLpBbzh5QQI97yuQP942mz13ROVBXzz4OaI4q0DCPDQwhj2+Pj1Aj0BCMBg67D1DPVdCwT+vOgRBskJIQtFAuz6MQypBhTyPOBY4NDw=",
  "B": 3.1,
  "decision": "audit",
  "group": "edge_hotspot",
  "peak": 88.0,
  "units": {
    "mu": "K",
    "sd": "K",
    "B": "K",
    "peak": "K"
  },
  "shape": [
    4,
    8,
    8
  ],
  "t_server_ns": 0
}
